{
  "$schema": "https://json-schema.org/draft/2020-12/schema",
  "$id": "schema://frank.pack/v1",
  "title": "FRANK customer and industry pack",
  "description": "FRANK-\u00a76.10. A versioned extension pack for customer or industry-specific modules, configurations, and workflows. A pack may extend schemas through declared extension tables and JSON Schema fields. It may not fork core tables, bypass policy, read another cell, or replace canonical identity and audit.",
  "type": "object",
  "additionalProperties": false,
  "required": [
    "schema",
    "id",
    "version",
    "requires_core",
    "namespace",
    "license",
    "permissions",
    "configuration_schema",
    "modules",
    "roles",
    "workflows",
    "terminology",
    "navigation",
    "ui_slots",
    "policies",
    "connectors",
    "reports",
    "events",
    "migrations",
    "data_ownership",
    "disable_behavior",
    "export_handler",
    "uninstall_options",
    "recovery",
    "fixtures",
    "acceptance_suites"
  ],
  "properties": {
    "schema": {
      "const": "frank.pack/v1"
    },
    "id": {
      "description": "Pack identifier in dot-separated form, e.g. industry.real-estate.",
      "type": "string",
      "pattern": "^[a-z0-9]+([._-][a-z0-9]+)*$"
    },
    "version": {
      "description": "Semantic version of the pack.",
      "type": "string",
      "pattern": "^\\d+\\.\\d+\\.\\d+(-[a-zA-Z0-9]+(\\.[a-zA-Z0-9]+)*)?(\\+[a-zA-Z0-9]+(\\.[a-zA-Z0-9]+)*)?$"
    },
    "requires_core": {
      "description": "FRANK core version constraint required by this pack, using semantic versioning range syntax.",
      "type": "string",
      "minLength": 1
    },
    "namespace": {
      "description": "Single namespace prefix for all identifiers introduced by this pack, preventing collisions.",
      "type": "string",
      "pattern": "^[a-z0-9_]+$"
    },
    "license": {
      "description": "License identifier for this pack.",
      "type": "string",
      "minLength": 1
    },
    "signature": {
      "description": "Cryptographic signature verifying pack integrity and origin.",
      "type": "string"
    },
    "permissions": {
      "description": "Array of additional permission scopes this pack requires beyond its modules.",
      "type": "array",
      "items": {
        "type": "string",
        "minLength": 1
      }
    },
    "configuration_schema": {
      "description": "Schema identifier for pack-specific configuration options.",
      "type": "string",
      "minLength": 1
    },
    "modules": {
      "description": "Array of module identifiers (with versions) included or extended by this pack.",
      "type": "array",
      "items": {
        "type": "string",
        "minLength": 1
      }
    },
    "roles": {
      "description": "Array of new role definitions specific to this pack's workflow.",
      "type": "array",
      "items": {
        "type": "string",
        "minLength": 1
      }
    },
    "workflows": {
      "description": "Array of workflow identifiers provided by this pack.",
      "type": "array",
      "items": {
        "type": "string",
        "minLength": 1
      }
    },
    "terminology": {
      "description": "Object mapping domain-specific terms and labels introduced by this pack.",
      "type": "object",
      "additionalProperties": {
        "type": "string"
      }
    },
    "navigation": {
      "description": "Object defining navigation menu structure and section additions.",
      "type": "object",
      "additionalProperties": true
    },
    "ui_slots": {
      "description": "Array of UI extension points where pack components integrate.",
      "type": "array",
      "items": {
        "type": "string",
        "minLength": 1
      }
    },
    "policies": {
      "description": "Array of policy document identifiers defined by this pack.",
      "type": "array",
      "items": {
        "type": "string",
        "minLength": 1
      }
    },
    "connectors": {
      "description": "Array of connector identifiers provided by this pack.",
      "type": "array",
      "items": {
        "type": "string",
        "minLength": 1
      }
    },
    "reports": {
      "description": "Array of report template identifiers provided by this pack.",
      "type": "array",
      "items": {
        "type": "string",
        "minLength": 1
      }
    },
    "events": {
      "description": "Event types owned and consumed by this pack.",
      "type": "object",
      "additionalProperties": false,
      "required": [
        "owns",
        "consumes"
      ],
      "properties": {
        "owns": {
          "description": "Array of event types introduced by this pack.",
          "type": "array",
          "items": {
            "type": "string",
            "minLength": 1
          }
        },
        "consumes": {
          "description": "Array of core event types this pack subscribes to.",
          "type": "array",
          "items": {
            "type": "string",
            "minLength": 1
          }
        }
      }
    },
    "migrations": {
      "description": "Array of migration identifiers to run when activating this pack.",
      "type": "array",
      "items": {
        "type": "string",
        "minLength": 1
      }
    },
    "data_ownership": {
      "description": "FRANK-\u00a76.10. Declaration of tables and data extensions owned by this pack.",
      "type": "object",
      "additionalProperties": false,
      "required": [
        "tables",
        "retained_on_disable"
      ],
      "properties": {
        "tables": {
          "description": "Array of extension table identifiers owned by this pack. Pack may not fork core tables.",
          "type": "array",
          "items": {
            "type": "string",
            "minLength": 1
          }
        },
        "retained_on_disable": {
          "description": "If true, pack data persists when the pack is disabled. If false, data is archived per uninstall_options.",
          "type": "boolean"
        }
      }
    },
    "disable_behavior": {
      "description": "Behavior when the pack is disabled: stop-triggers-and-hide-write-actions (default), or retain-read-only.",
      "type": "string",
      "enum": [
        "stop-triggers-and-hide-write-actions",
        "retain-read-only"
      ]
    },
    "export_handler": {
      "description": "Handler identifier for exporting pack-specific data.",
      "type": "string",
      "minLength": 1
    },
    "uninstall_options": {
      "description": "Array of available pack data handling options during uninstall: retain-read-only, export-and-delete, migrate.",
      "type": "array",
      "items": {
        "type": "string",
        "enum": [
          "retain-read-only",
          "export-and-delete",
          "migrate"
        ]
      },
      "minItems": 1
    },
    "recovery": {
      "description": "FRANK-\u00a76.10. Enumerated, not free text: an unrecognised recovery strategy is indistinguishable from a typo at the moment it is needed.",
      "type": "string",
      "enum": [
        "restore-prior-compatible-pack",
        "manual-intervention"
      ]
    },
    "fixtures": {
      "description": "Array of test fixture identifiers for acceptance testing.",
      "type": "array",
      "items": {
        "type": "string",
        "minLength": 1
      }
    },
    "acceptance_suites": {
      "description": "Array of acceptance test suite identifiers for this pack.",
      "type": "array",
      "items": {
        "type": "string",
        "minLength": 1
      }
    }
  }
}
