{
  "schema": "frank.pack/v1",
  "id": "industry.real-estate",
  "version": "1.0.0",
  "requires_core": ">=1.0 <2.0",
  "namespace": "real_estate",
  "license": "commercial-internal",
  "signature": "...",
  "permissions": [],
  "configuration_schema": "schema://packs/real-estate/config/v1",
  "modules": [],
  "roles": [],
  "workflows": [],
  "terminology": {},
  "navigation": {},
  "ui_slots": [],
  "policies": [],
  "connectors": [],
  "reports": [],
  "events": {
    "owns": [],
    "consumes": []
  },
  "migrations": [],
  "data_ownership": {
    "tables": [],
    "retained_on_disable": true
  },
  "disable_behavior": "stop-triggers-and-hide-write-actions",
  "export_handler": "real-estate.export@1",
  "uninstall_options": [
    "retain-read-only",
    "export-and-delete",
    "migrate"
  ],
  "recovery": "restore-prior-compatible-pack",
  "fixtures": [],
  "acceptance_suites": []
}
